{
  "$schema": "../../schema/scenario.v1.schema.json",
  "schemaVersion": "oss-benchmark-scenario/v1",
  "name": "smoke-plain",
  "executionClass": "smoke",
  "dataset": {
    "path": "datasets/smoke-1k.v1.json",
    "sha256": "ee4adcf73526a72e91a72c5d12c4c930b883fd8b50362df932913240524cbaeb"
  },
  "workload": {
    "path": "workloads/point-closed-smoke.v1.json",
    "sha256": "a66c16ec5a332f2234a5a425afe4d19a80f1702618d5ad0967a4c047f5c6755e"
  },
  "population": {
    "enabled": true,
    "concurrency": 8,
    "operationTimeoutSeconds": 15,
    "lateCallDrainTimeoutSeconds": 15,
    "restoreAfterWarmup": false
  },
  "audit": {
    "enabled": true,
    "pointSampleCount": 1000,
    "querySampleCount": 0,
    "maximumOfflineQueryScanRecords": 100000,
    "operationTimeoutSeconds": 15,
    "lateCallDrainTimeoutSeconds": 15
  },
  "storage": {
    "backend": "Memory",
    "path": "Plain",
    "connectionStringEnvironment": "",
    "azureBlobContainer": "oss-benchmarks",
    "partitionCount": 16,
    "virtualSlotTargetCount": 1024,
    "journalSegmentCapacity": 64,
    "maximumJournalReplayEntries": 4096,
    "compactionThreshold": 2048
  },
  "topology": {
    "siloCount": 1,
    "mode": "Embedded",
    "embeddedSiloCount": 1,
    "clusterId": "oss-benchmark",
    "serviceId": "oss-benchmark",
    "advertisedAddress": "127.0.0.1",
    "primarySiloEndpoint": "",
    "gatewayEndpoints": [],
    "siloPort": 11111,
    "gatewayPort": 30000,
    "barrierTimeoutSeconds": 120,
    "barrierLateCallDrainTimeoutSeconds": 15
  }
}
